{
  "$schema": "https://json-schema.org/draft/2020-12/schema",
  "$id": "https://killsloprouter.dev/schemas/design-brief.schema.json",
  "title": "KillSlopRouter design exploration brief",
  "type": "object",
  "required": [
    "design_brief_version", "project_id", "surface", "screen_id", "locales", "product",
    "baseline_policy", "editorial_boundary", "directions", "color_strategies", "providers", "evidence"
  ],
  "properties": {
    "source_craft_review": {
      "type": "object", "additionalProperties": false,
      "required": ["authority", "provider_id"],
      "properties": {
        "provider_id": {"type": "string", "minLength": 1},
        "authority": {
          "type": "object", "additionalProperties": false,
          "required": ["path", "digest"],
          "properties": {
            "path": {"type": "string", "minLength": 1},
            "digest": {"type": "string", "pattern": "^sha256:[a-f0-9]{64}$"}
          }
        }
      }
    },
    "design_brief_version": {"const": 1},
    "component_craft": {"$ref": "component-craft.schema.json"},
    "project_id": {"type": "string", "minLength": 1},
    "surface": {"enum": ["operator-product-ui", "consumer-product-ui", "marketing-editorial"]},
    "screen_id": {"type": "string", "pattern": "^[A-Za-z0-9][A-Za-z0-9._-]*$"},
    "locales": {"$ref": "#/$defs/strings"},
    "reference_opt_out": {
      "type": "object",
      "required": ["path", "digest"],
      "properties": {
        "path": {"type": "string", "minLength": 1},
        "digest": {"type": "string", "pattern": "^sha256:[a-f0-9]{64}$"}
      },
      "additionalProperties": false
    },
    "reference_requirement": {
      "type": "object",
      "required": ["mode", "required_recipe_families"],
      "properties": {
        "mode": {"const": "required"},
        "required_recipe_families": {
          "type": "array", "uniqueItems": true,
          "items": {"type": "string", "pattern": "^[A-Za-z0-9][A-Za-z0-9._-]*$"}
        }
      },
      "additionalProperties": false
    },
    "reference_pack": {
      "type": "object",
      "required": ["path", "digest", "producer_state", "reviewer_source_access"],
      "properties": {
        "path": {"type": "string", "minLength": 1},
        "digest": {"type": "string", "pattern": "^sha256:[a-f0-9]{64}$"},
        "producer_state": {
          "type": "object",
          "required": ["path", "digest"],
          "properties": {
            "path": {"type": "string", "minLength": 1},
            "digest": {"type": "string", "pattern": "^sha256:[a-f0-9]{64}$"}
          },
          "additionalProperties": false
        },
        "reviewer_source_access": {
          "type": "object",
          "required": [
            "reviewer_source_access_version", "mode", "purposes",
            "allowed_evidence_kinds", "redistribution", "creator_access",
            "browser_provider_access", "external_network"
          ],
          "properties": {
            "reviewer_source_access_version": {"const": 1},
            "mode": {"const": "digest-bound-internal-critic"},
            "purposes": {
              "type": "array", "minItems": 2, "maxItems": 2, "uniqueItems": true,
              "items": {"enum": [
                "promotional-citation-firewall", "source-composition-independence"
              ]}
            },
            "allowed_evidence_kinds": {
              "type": "array", "minItems": 1, "maxItems": 1,
              "items": {"const": "source-capture"}
            },
            "redistribution": {"const": false},
            "creator_access": {"const": false},
            "browser_provider_access": {"const": false},
            "external_network": {"const": false}
          },
          "additionalProperties": false
        }
      },
      "additionalProperties": false
    },
    "product": {
      "type": "object",
      "required": ["primary_user", "user_job", "screen_family", "main_object", "core_task", "trust_risk", "density", "required_states", "success_metric"],
      "properties": {
        "primary_user": {"type": "string", "minLength": 1},
        "user_job": {"type": "string", "minLength": 1},
        "screen_family": {"type": "string", "minLength": 1},
        "main_object": {"type": "string", "minLength": 1},
        "core_task": {"type": "string", "minLength": 1},
        "trust_risk": {"enum": ["standard", "high"]},
        "density": {"enum": ["low", "medium", "high"]},
        "required_states": {"$ref": "#/$defs/strings"},
        "success_metric": {"type": "string", "minLength": 1}
      },
      "additionalProperties": false
    },
    "baseline_policy": {
      "type": "object",
      "required": ["preserve", "may_change", "forbid"],
      "properties": {
        "preserve": {"$ref": "#/$defs/strings"},
        "may_change": {"$ref": "#/$defs/optional-strings"},
        "forbid": {"$ref": "#/$defs/strings"}
      },
      "additionalProperties": false
    },
    "editorial_boundary": {
      "type": "object",
      "required": ["treatment", "scope"],
      "properties": {
        "treatment": {"enum": ["forbidden", "bounded", "required"]},
        "scope": {"$ref": "#/$defs/optional-strings"}
      },
      "additionalProperties": false
    },
    "directions": {
      "type": "array", "minItems": 1, "maxItems": 3,
      "items": {"$ref": "#/$defs/direction"}
    },
    "color_strategies": {
      "type": "array", "minItems": 0, "maxItems": 3,
      "items": {"$ref": "#/$defs/color-strategy"}
    },
    "providers": {
      "type": "object",
      "required": ["direction_reviewer", "color_reviewer", "browser_evidence"],
      "properties": {
        "direction_reviewer": {"type": "string", "minLength": 1},
        "color_reviewer": {"type": "string", "minLength": 1},
        "browser_evidence": {"type": "string", "minLength": 1},
        "specimen_reviewer": {
          "type": "string",
          "minLength": 1
        }
      },
      "additionalProperties": false
    },
    "evidence": {
      "type": "object",
      "required": ["required_viewports", "required_checks", "required_states"],
      "properties": {
        "required_viewports": {"allOf": [{"$ref": "#/$defs/strings"}, {"minItems": 2}]},
        "required_checks": {"$ref": "#/$defs/strings"},
        "required_states": {"$ref": "#/$defs/strings"}
      },
      "additionalProperties": false
    },
    "visual_goal_contract": {
      "$ref": "visual-goal-contract.schema.json"
    },
    "constraint_audit": {"$ref": "design-constraint-audit.schema.json"},
    "reference_candidate": {"$ref": "design-reference-candidate.schema.json"},
    "specimen_feedback": {
      "type": "object",
      "required": [
        "specimen_feedback_version",
        "candidate_id"
      ],
      "properties": {
        "specimen_feedback_version": {
          "const": 1
        },
        "candidate_id": {
          "type": "string",
          "minLength": 1
        }
      },
      "additionalProperties": false
    }
  },
  "$defs": {
    "strings": {"type": "array", "minItems": 1, "uniqueItems": true, "items": {"type": "string", "minLength": 1}},
    "optional-strings": {"type": "array", "uniqueItems": true, "items": {"type": "string", "minLength": 1}},
    "direction": {
      "type": "object",
      "required": ["id", "name", "thesis", "subject_world", "dominant_influence", "signature_element", "aesthetic_sources", "anti_references", "allowed_energy", "allowed_depth", "creator_provider_id"],
      "properties": {
        "id": {"type": "string", "pattern": "^(?!.*--)[A-Za-z0-9][A-Za-z0-9._-]*$"},
        "name": {"type": "string", "minLength": 1},
        "thesis": {"type": "string", "minLength": 1},
        "subject_world": {"$ref": "#/$defs/strings"},
        "dominant_influence": {"type": "string", "minLength": 1},
        "supporting_influence": {"type": "string", "minLength": 1},
        "signature_element": {"type": "string", "minLength": 1},
        "aesthetic_sources": {"$ref": "#/$defs/strings"},
        "anti_references": {"$ref": "#/$defs/strings"},
        "allowed_energy": {"type": "array", "minItems": 1, "uniqueItems": true, "items": {"enum": ["quiet", "balanced", "high"]}},
        "allowed_depth": {"type": "array", "minItems": 1, "uniqueItems": true, "items": {"enum": ["flat", "layered", "immersive"]}},
        "creator_provider_id": {"type": "string", "minLength": 1}
      },
      "additionalProperties": false
    },
    "color-strategy": {
      "type": "object",
      "required": ["id", "name", "color_space", "harmony_strategy", "seed_sources", "role_intent", "anti_patterns", "creator_provider_id"],
      "properties": {
        "id": {"type": "string", "pattern": "^(?!.*--)[A-Za-z0-9][A-Za-z0-9._-]*$"},
        "name": {"type": "string", "minLength": 1},
        "color_space": {"enum": ["oklch", "hct"]},
        "harmony_strategy": {"type": "string", "minLength": 1},
        "seed_sources": {"$ref": "#/$defs/strings"},
        "role_intent": {"$ref": "#/$defs/strings"},
        "anti_patterns": {"$ref": "#/$defs/strings"},
        "creator_provider_id": {"type": "string", "minLength": 1}
      },
      "additionalProperties": false
    }
  },
  "allOf": [{
    "if": {"required": ["source_craft_review"]},
    "then": {"required": ["reference_candidate", "specimen_feedback", "component_craft", "visual_goal_contract", "reference_pack"]}
  }, {
    "if": {"required": ["reference_candidate"]},
    "then": {
      "required": ["reference_pack", "specimen_feedback", "visual_goal_contract", "component_craft", "constraint_audit"],
      "properties": {"directions": {"minItems": 1, "maxItems": 1}, "color_strategies": {"maxItems": 0}}
    },
    "else": {"properties": {"directions": {"minItems": 3, "maxItems": 3}, "color_strategies": {"minItems": 3, "maxItems": 3}}}
  }, {
    "if": {"required": ["reference_requirement"]},
    "then": {"required": ["reference_pack"]}
  }, {
    "if": {"required": ["reference_opt_out"]},
    "then": {"not": {"anyOf": [{"required": ["reference_requirement"]}, {"required": ["reference_pack"]}]}}
  }, {
    "if": {"required": ["visual_goal_contract"]},
    "then": {"required": ["component_craft", "reference_pack"]}
  }, {
    "if": {"required": ["specimen_feedback"]},
    "then": {"required": ["visual_goal_contract"], "properties": {
      "providers": {"required": ["specimen_reviewer"]}
    }}
  }],
  "additionalProperties": false
}
